{
  "$schema": "https://json-schema.org/draft/2020-12/schema",
  "$id": "https://github.com/Eric871/research-semantic-ledger/contracts/gold-v0.1.schema.json",
  "title": "Research Semantic Ledger Gold v0.1",
  "type": "object",
  "required": ["schema_version", "document_id", "cases"],
  "properties": {
    "schema_version": {"const": "research_semantic_ledger_gold_v0.1"},
    "document_id": {"type": "string", "minLength": 1},
    "description": {"type": "string"},
    "cases": {
      "type": "array",
      "minItems": 1,
      "items": {
        "type": "object",
        "required": ["case_id", "target"],
        "properties": {
          "case_id": {"type": "string", "minLength": 1},
          "dimension": {"type": "string"},
          "target": {"enum": ["mention_bindings", "claims", "relations"]},
          "exact": {"type": "object"},
          "contains": {"type": "object", "additionalProperties": {"type": "string"}},
          "list_contains": {"type": "object", "additionalProperties": {"type": "array"}},
          "minimum_matches": {"type": "integer", "minimum": 0},
          "maximum_matches": {"type": "integer", "minimum": 0}
        },
        "additionalProperties": false
      }
    }
  },
  "additionalProperties": false
}
